{
  "$schema": "https://json-schema.org/draft/2020-12/schema",
  "$id": "https://deeptimes.dev/dsk/config.schema.json",
  "type": "object",
  "additionalProperties": false,
  "required": ["schemaVersion", "paths"],
  "properties": {
    "schemaVersion": { "const": 1 },
    "paths": {
      "type": "object",
      "additionalProperties": false,
      "required": ["schemaSource", "resourceSource", "seeds", "manifest"],
      "properties": {
        "schemaSource": { "type": "string", "minLength": 1 },
        "resourceSource": { "type": "string", "minLength": 1 },
        "seeds": { "type": "string", "minLength": 1 },
        "manifest": { "type": "string", "minLength": 1 }
      }
    },
    "env": {
      "type": "object",
      "additionalProperties": false,
      "properties": {
        "file": { "type": "string", "minLength": 1 },
        "allowedVariables": { "type": "array", "uniqueItems": true, "items": { "type": "string", "pattern": "^[A-Z_][A-Z0-9_]*$" } }
      }
    },
    "validation": {
      "type": "object",
      "additionalProperties": false,
      "properties": { "requireChineseTranslations": { "type": "boolean" } }
    },
    "safety": {
      "type": "object",
      "additionalProperties": false,
      "properties": { "clearEnabled": { "type": "boolean" } }
    }
  }
}
